{
  "clusters": [
    {
      "alt_roles": [
        [
          "PRICING",
          75
        ]
      ],
      "bbox": {
        "h": 72,
        "w": 1227,
        "x": 173,
        "y": 0
      },
      "cluster_id": 5,
      "confidence": 75,
      "element_count": 9,
      "element_indices": [
        24,
        25,
        26,
        27,
        28,
        29,
        30,
        31,
        32
      ],
      "has_cta": true,
      "has_h1": false,
      "rel_y": [
        0.006,
        0.007
      ],
      "role": "NAV"
    },
    {
      "alt_roles": [],
      "bbox": {
        "h": 387,
        "w": 1208,
        "x": 116,
        "y": 192
      },
      "cluster_id": 0,
      "confidence": 70,
      "element_count": 2,
      "element_indices": [
        0,
        72
      ],
      "has_cta": false,
      "has_h1": true,
      "rel_y": [
        0.061,
        0.068
      ],
      "role": "HERO"
    },
    {
      "alt_roles": [],
      "bbox": {
        "h": 3000,
        "w": 3038,
        "x": 0,
        "y": 819
      },
      "cluster_id": 1,
      "confidence": 65,
      "element_count": 44,
      "element_indices": [
        1,
        2,
        3,
        4,
        5,
        6,
        7,
        8,
        9,
        10,
        11,
        12,
        13,
        14,
        15,
        33,
        34,
        70,
        73,
        74,
        75,
        76,
        77,
        78,
        79,
        80,
        81,
        82,
        83,
        84,
        85,
        86,
        87,
        88,
        89,
        90,
        91,
        92,
        93,
        94,
        96,
        98,
        110,
        111
      ],
      "has_cta": true,
      "has_h1": false,
      "rel_y": [
        0.148,
        0.48
      ],
      "role": "FAQ"
    },
    {
      "alt_roles": [],
      "bbox": {
        "h": 828,
        "w": 1160,
        "x": 140,
        "y": 2992
      },
      "cluster_id": 2,
      "confidence": 30,
      "element_count": 13,
      "element_indices": [
        16,
        17,
        18,
        35,
        95,
        97,
        99,
        100,
        101,
        102,
        103,
        104,
        105
      ],
      "has_cta": true,
      "has_h1": false,
      "rel_y": [
        0.53,
        0.667
      ],
      "role": "CONTENT"
    },
    {
      "alt_roles": [],
      "bbox": {
        "h": 248,
        "w": 1160,
        "x": 140,
        "y": 4060
      },
      "cluster_id": 3,
      "confidence": 30,
      "element_count": 4,
      "element_indices": [
        19,
        20,
        21,
        22
      ],
      "has_cta": false,
      "has_h1": false,
      "rel_y": [
        0.719,
        0.754
      ],
      "role": "CONTENT"
    },
    {
      "alt_roles": [],
      "bbox": {
        "h": 954,
        "w": 1382,
        "x": 116,
        "y": 4723
      },
      "cluster_id": 4,
      "confidence": 75,
      "element_count": 39,
      "element_indices": [
        23,
        37,
        38,
        39,
        40,
        41,
        42,
        43,
        44,
        45,
        46,
        47,
        48,
        49,
        50,
        51,
        52,
        53,
        54,
        55,
        56,
        57,
        58,
        59,
        60,
        61,
        62,
        63,
        64,
        65,
        66,
        67,
        68,
        69,
        106,
        107,
        108,
        109,
        112
      ],
      "has_cta": true,
      "has_h1": false,
      "rel_y": [
        0.855,
        0.999
      ],
      "role": "PRICING"
    }
  ],
  "elements": [
    {
      "_src_section_id": "section_0",
      "_src_section_type": "hero",
      "bbox": {
        "h": 126,
        "w": 781,
        "x": 543,
        "y": 283
      },
      "cluster_id": 0,
      "computedStyle": {
        "backgroundColor": "rgb(255,255,255)",
        "color": "rgb(24, 22, 76)",
        "contrastRatio": 16.7,
        "fontSize": "63px",
        "fontWeight": "700",
        "lineHeight": "63px"
      },
      "noise_reasons": [],
      "noise_score": 0,
      "tag": "h1",
      "text": "Articles to help you unlock new markets",
      "type": "heading"
    },
    {
      "_src_section_id": "section_0",
      "_src_section_type": "hero",
      "bbox": {
        "h": 48,
        "w": 1208,
        "x": 116,
        "y": 819
      },
      "cluster_id": 1,
      "computedStyle": {
        "backgroundColor": "rgb(246,247,251)",
        "color": "rgb(24, 22, 76)",
        "contrastRatio": 15.6,
        "fontSize": "48px",
        "fontWeight": "700",
        "lineHeight": "48px"
      },
      "noise_reasons": [
        "banner_thin_wide"
      ],
      "noise_score": 20,
      "tag": "h2",
      "text": "Most popular articles",
      "type": "heading"
    },
    {
      "_src_section_id": "section_0",
      "_src_section_type": "hero",
      "bbox": {
        "h": 58,
        "w": 299,
        "x": 140,
        "y": 1197
      },
      "cluster_id": 1,
      "computedStyle": {
        "backgroundColor": "rgb(245,205,255)",
        "color": "rgb(24, 22, 76)",
        "contrastRatio": 12,
        "fontSize": "24px",
        "fontWeight": "700",
        "lineHeight": "28.8px"
      },
      "noise_reasons": [],
      "noise_score": 0,
      "tag": "h3",
      "text": "Complete Guide to Localization Testing: Best Practices and Step by Step",
      "type": "heading"
    },
    {
      "_src_section_id": "section_0",
      "_src_section_type": "hero",
      "bbox": {
        "h": 58,
        "w": 299,
        "x": 511,
        "y": 1197
      },
      "cluster_id": 1,
      "computedStyle": {
        "backgroundColor": "rgb(255,255,255)",
        "color": "rgb(24, 22, 76)",
        "contrastRatio": 16.7,
        "fontSize": "24px",
        "fontWeight": "700",
        "lineHeight": "28.8px"
      },
      "noise_reasons": [],
      "noise_score": 0,
      "tag": "h3",
      "text": "How to See Google Search Results for Different Countries (Step-By-Step)",
      "type": "heading"
    },
    {
      "_src_section_id": "section_0",
      "_src_section_type": "hero",
      "bbox": {
        "h": 58,
        "w": 299,
        "x": 883,
        "y": 1197
      },
      "cluster_id": 1,
      "computedStyle": {
        "backgroundColor": "rgb(194,227,251)",
        "color": "rgb(24, 22, 76)",
        "contrastRatio": 12.5,
        "fontSize": "24px",
        "fontWeight": "700",
        "lineHeight": "28.8px"
      },
      "noise_reasons": [],
      "noise_score": 0,
      "tag": "h3",
      "text": "How Accurate is Google Translate?",
      "type": "heading"
    },
    {
      "_src_section_id": "section_0",
      "_src_section_type": "hero",
      "bbox": {
        "h": 58,
        "w": 299,
        "x": 1254,
        "y": 1228
      },
      "cluster_id": 1,
      "computedStyle": {
        "backgroundColor": "rgb(255,255,255)",
        "color": "rgb(24, 22, 76)",
        "contrastRatio": 16.7,
        "fontSize": "24px",
        "fontWeight": "700",
        "lineHeight": "28.8px"
      },
      "noise_reasons": [],
      "noise_score": 0,
      "tag": "h3",
      "text": "How to Set up a Localization Workflow",
      "type": "heading"
    },
    {
      "_src_section_id": "section_0",
      "_src_section_type": "hero",
      "bbox": {
        "h": 58,
        "w": 299,
        "x": 1625,
        "y": 1028
      },
      "cluster_id": 1,
      "computedStyle": {
        "backgroundColor": "rgb(253,203,195)",
        "color": "rgb(24, 22, 76)",
        "contrastRatio": 11.5,
        "fontSize": "24px",
        "fontWeight": "700",
        "lineHeight": "28.8px"
      },
      "noise_reasons": [],
      "noise_score": 0,
      "tag": "h3",
      "text": "Decoding Netflix's Global Success: The Power of Localization",
      "type": "heading"
    },
    {
      "_src_section_id": "section_0",
      "_src_section_type": "hero",
      "bbox": {
        "h": 58,
        "w": 299,
        "x": 1996,
        "y": 1028
      },
      "cluster_id": 1,
      "computedStyle": {
        "backgroundColor": "rgb(255,255,255)",
        "color": "rgb(24, 22, 76)",
        "contrastRatio": 16.7,
        "fontSize": "24px",
        "fontWeight": "700",
        "lineHeight": "28.8px"
      },
      "noise_reasons": [],
      "noise_score": 0,
      "tag": "h3",
      "text": "Does AI Favor Translated Content? (+1.3 Million Citations Analyzed)",
      "type": "heading"
    },
    {
      "_src_section_id": "section_0",
      "_src_section_type": "hero",
      "bbox": {
        "h": 58,
        "w": 299,
        "x": 2368,
        "y": 1028
      },
      "cluster_id": 1,
      "computedStyle": {
        "backgroundColor": "rgb(245,205,255)",
        "color": "rgb(24, 22, 76)",
        "contrastRatio": 12,
        "fontSize": "24px",
        "fontWeight": "700",
        "lineHeight": "28.8px"
      },
      "noise_reasons": [],
      "noise_score": 0,
      "tag": "h3",
      "text": "6 Marketing Tips to Get Found by International Customers Online",
      "type": "heading"
    },
    {
      "_src_section_id": "section_0",
      "_src_section_type": "hero",
      "bbox": {
        "h": 58,
        "w": 299,
        "x": 2739,
        "y": 1028
      },
      "cluster_id": 1,
      "computedStyle": {
        "backgroundColor": "rgb(255,255,255)",
        "color": "rgb(24, 22, 76)",
        "contrastRatio": 16.7,
        "fontSize": "24px",
        "fontWeight": "700",
        "lineHeight": "28.8px"
      },
      "noise_reasons": [],
      "noise_score": 0,
      "tag": "h3",
      "text": "17 Best Multilingual Web Fonts to Use on Your Website in 2024",
      "type": "heading"
    },
    {
      "_src_section_id": "section_0",
      "_src_section_type": "hero",
      "bbox": {
        "h": 58,
        "w": 328,
        "x": 140,
        "y": 2026
      },
      "cluster_id": 1,
      "computedStyle": {
        "backgroundColor": "rgb(245,205,255)",